	Statement,Header,Field Name,Field Value
Statement,Data,BrokerName,Interactive Brokers
Statement,Data,BrokerAddress,
Statement,Data,Title,Activity Statement
Statement,Data,Period,"June 6, 2018"
Statement,Data,WhenGenerated,"2018-06-07, 04:31:39 EDT"
Account Information,Header,Field Name,Field Value
Account Information,Data,Name,DONTIA D MOORE Sr.
Account Information,Data,Account,U2519271
Account Information,Data,Money Manager,IB Asset Management
Account Information,Data,Account Type,Money Manager Client
Account Information,Data,Customer Type,Individual
Account Information,Data,Account Capabilities,Margin
Account Information,Data,Base Currency,USD
Net Asset Value,Header,Asset Class,Prior Total,Current Long,Current Short,Current Total,Change
Net Asset Value,Data,Total,0,0,0,0,0
Net Asset Value,Header,Time Weighted Rate of Return
Net Asset Value,Data,0%
Change in NAV,Header,Field Name,Field Value
Change in NAV,Data,Starting Value,0
Change in NAV,Data,Ending Value,0
Cash Report,Header,Currency Summary,Currency,Total,Securities,Futures,Month to Date,Year to Date,
Cash Report,Data,Starting Cash,Base Currency Summary,0,0,0,,,
Cash Report,Data,Ending Cash,Base Currency Summary,0,0,0,,,
Cash Report,Data,Ending Settled Cash,Base Currency Summary,0,0,0,,,
Statement of Funds,Header,Currency,Report Date,Activity Date,Description,Debit,Credit,Balance
Statement of Funds,Data,Base Currency Summary,2018-06-06,,Opening Balance, , ,0
Statement of Funds,Data,Base Currency Summary,2018-06-06,,Closing Balance, , ,0
"No exercises, assignments or expirations for June 6, 2018"
Base Currency Exchange Rate,Header,Currency,Rate
Base Currency Exchange Rate,Data,AUD,0.766710
Base Currency Exchange Rate,Data,BRL,0.259640
Base Currency Exchange Rate,Data,CAD,0.772630
Base Currency Exchange Rate,Data,CHF,1.013700
Base Currency Exchange Rate,Data,CNH,0.156790
Base Currency Exchange Rate,Data,CNY,0.156530
Base Currency Exchange Rate,Data,CZK,0.045868
Base Currency Exchange Rate,Data,DKK,0.158120
Base Currency Exchange Rate,Data,EUR,1.177400
Base Currency Exchange Rate,Data,GBP,1.341300
Base Currency Exchange Rate,Data,HKD,0.127430
Base Currency Exchange Rate,Data,HUF,0.003704
Base Currency Exchange Rate,Data,ILS,0.280020
Base Currency Exchange Rate,Data,INR,0.014961
Base Currency Exchange Rate,Data,JPY,0.009076
Base Currency Exchange Rate,Data,KRW,0.000937
Base Currency Exchange Rate,Data,MXN,0.049264
Base Currency Exchange Rate,Data,NOK,0.123750
Base Currency Exchange Rate,Data,NZD,0.703350
Base Currency Exchange Rate,Data,PLN,0.275990
Base Currency Exchange Rate,Data,RUB,0.016178
Base Currency Exchange Rate,Data,SEK,0.114490
Base Currency Exchange Rate,Data,SGD,0.750430
Base Currency Exchange Rate,Data,THB,0.031336
Base Currency Exchange Rate,Data,TRY,0.219480
Base Currency Exchange Rate,Data,ZAR,0.078678
Codes,Header,Code,Meaning,Code (Cont.),Meaning (Cont.)
Codes,Data,A,Assignment
Codes,Data,AEx,Automatic exercise for dividend-related recommendation.
Codes,Data,Adj,Adjustment
Codes,Data,Al,Allocation
Codes,Data,Aw,Away Trade
Codes,Data,B,Automatic Buy-in
Codes,Data,Bo,Direct Borrow
Codes,Data,C,Closing Trade
Codes,Data,CD,Cash Delivery
Codes,Data,CP,Complex Position
Codes,Data,Ca,Cancelled
Codes,Data,Co,Corrected Trade
Codes,Data,CovX,"At least part of this trade was an agency cross transaction in which IB acted as a broker for both the buyer and the seller, at least one of which is a Covestor Ltd. advisory client. Covestor Ltd. does business under the names ""Interactive Brokers Asset Management"", or ""IB Asset Management"". IB received commissions from you for this agency cross trade in an amount equal to or less than the amount reflected on this statement less any applicable exchange fees. IB also received commissions in a similar amount from its other customer who was on the other side of this trade. IB did not share any of these commissions with IB Asset Management. IB will furnish you with information on the source and precise amount of any commissions charged in connection with this agency cross trade upon written request."
Codes,Data,Cx,Part or all of this transaction was a Crossing executed as dual agent by IB for two IB customers
Codes,Data,ETF,ETF Creation/Redemption
Codes,Data,Ep,Resulted from an Expired Position
Codes,Data,Ex,Exercise
Codes,Data,FrX,"At least part of this trade was a fractional share agency cross transaction in which IB acted as a broker for both you, a Covestor Ltd. advisory client, and an IB liquidity provider. Covestor Ltd. does business under the names ""Interactive Brokers Asset Management"", or ""IB Asset Management"". IB received commissions from you for this fractional agency cross trade in an amount equal to or less than the amount reflected on this statement less any applicable exchange fees. IB did not charge the liquidity provider to this fractional agency cross trade any commissions. IB did not share any of these commissions with IB Asset Management. IB will furnish you with information on the source and the precise amount of any commissions charged in connection with this fractional agency cross trade upon written request."
Codes,Data,G,Trade in Guaranteed Account Segment
Codes,Data,HC,Highest Cost tax basis election
Codes,Data,HFI,Investment Transferred to Hedge Fund
Codes,Data,HFR,Redemption from Hedge Fund
Codes,Data,I,Internal Transfer
Codes,Data,IA,This transaction was executed against an IB affiliate
Codes,Data,INV,Investment Transfer from Investor
Codes,Data,IPO,This transaction was executed as part of an IPO in which IB was a member of the selling group and is classified as a Principal trade.
Codes,Data,L,Ordered by IB (Margin Violation)
Codes,Data,LD,Adjusted by Loss Disallowed from Wash Sale
Codes,Data,LI,"Last In, First Out (LIFO) tax basis election"
Codes,Data,LT,Long Term P/L
Codes,Data,Lo,Direct Loan
Codes,Data,M,Entered manually by IB
Codes,Data,MEx,Manual exercise for dividend-related recommendation.
Codes,Data,ML,Maximize Losses tax basis election
Codes,Data,MLG,Maximize Long Term Gain tax basis election
Codes,Data,MLL,Maximize Long Term Loss tax basis election
Codes,Data,MSG,Maximize Short Term Gain tax basis election
Codes,Data,MSL,Maximize Short Term Loss tax basis election
Codes,Data,O,Opening Trade
Codes,Data,P,Partial Execution
Codes,Data,PI,Price Improvement
Codes,Data,Po,Interest or Dividend Accrual Posting
Codes,Data,Pr,Part or all of this transaction was executed by the Exchange as a Crossing by IB against an IB affiliate and is therefore classified as a Principal and not an agency trade
Codes,Data,R,Dividend Reinvestment
Codes,Data,RED,Redemption to Investor
Codes,Data,Re,Interest or Dividend Accrual Reversal
Codes,Data,Ri,Reimbursement
Codes,Data,SI,This order was solicited by Interactive Brokers
Codes,Data,SL,Specific Lot tax basis election
Codes,Data,SO,This order was marked as solicited by your Introducing Broker
Codes,Data,SS,Customer designated this trade for shortened settlement and so is subject to execution at prices above the prevailing market
Codes,Data,ST,Short Term P/L
Codes,Data,T,Transfer
Notes/Legal Notes,Header,Type,Note
Notes/Legal Notes,Data,Notes,"Most stock exchange transactions settle on the trade date plus two business days. Options, futures and US open-end mutual fund transactions settle on trade date plus one business day. (Some exchanges and other transaction types may have longer or shorter settlement periods.) Ending settled cash reflects the cash that has actually settled."
Notes/Legal Notes,Data,Notes,Initial and maintenance margin requirements are available within the Account Window of the Trader Workstation.
Notes/Legal Notes,Data,Notes,"Interactive Brokers LLC receives compensation from fund companies in connection with the purchase and holding of fund shares by customers of Interactive Brokers LLC. Such compensation includes, but is not limited to, Rule 12b-1 fees that are paid out of the funds assets. The source and amount of any remuneration received by Interactive Brokers LLC in connection with a transaction will be furnished upon written request of the customer.  IB may share a portion of the compensation received from fund companies with your financial advisor or introducing broker."
Notes/Legal Notes,Data,Notes,Quantities preceded by a "-" sign indicate sell transactions. Other transactions are purchases. 
Notes/Legal Notes,Data,Notes,"In case of partial executions, commissions are charged on the total quantity executed on the original order. The commission is displayed on the first partial execution only."
Notes/Legal Notes,Data,Notes,Each closed lot indicated above with a reference to note (6) was chosen by the end of the trading day to be sold versus the specific opening purchase identified in that row.
Notes/Legal Notes,Data,Notes,Trade execution times are displayed in Eastern Time.
Notes/Legal Notes,Data,Notes,Applicable commodity Regulatory Fees for your transactions are available on the IB website at www.interactivebrokers.com/en/accounts/fees/exchangeAndRegulatoryFees.php.
Notes/Legal Notes,Data,Notes,"Borrow Fee Rate represents the cost to borrow stock expressed in percent per annum. It is applied to the cash collateral amount on the stock borrow contract and is separate from any interest earned on credit cash balances. Similarly, Loan Fee Rate represents the benefit to lend stock. A positive rate indicates a cost to the borrower/benefit to the lender and a negative rate indicates a benefit to the borrower/cost to the lender. In general, the fee rates for hard-to-borrow stocks are higher than for normal availability stocks."
Notes/Legal Notes,Data,Notes,Interest Rate on Customer Collateral represents the interest paid on the collateral posted to the customer's account and received from lending stock.  A positive rate indicates a benefit to the lender.
Notes/Legal Notes,Data,Notes,"The closing prices on this Activity Statement are indicative and may come from third-party sources. Interactive Brokers does not warrant the accuracy of the prices provided by third-party sources. Due to time zone differences, certain non-US mutual funds may deliver closing prices after the Activity Statement has been produced and the closing prices for such funds will reflect the previous day's price."
Notes/Legal Notes,Data,Notes,"For clients whose accounts are being managed by an advisor, trades shown may be part of a larger trade that was allocated across multiple client accounts, based on an allocation algorithm specified by the advisor prior to execution of the trade.  Times shown are times that trades were allocated to your account.  Execution time on the relevant market center is available upon your request."
Notes/Legal Notes,Data,Notes,"If you specified that your advisor is to receive a per-trade advisory fee, please note that the figures in the ""Commiss"" column in the transaction listings are gross amounts that include both IB's brokerage commission for the trade as well as the advisor's per-trade fee.  IB receives its standard published brokerage commissions on your trades ( see www.interactivebrokers.com ). To determine the advisor's per-trade fee for any trade, subtract IB's standard commission from the amount shown."
Notes/Legal Notes,Data,Fixed Income Notes,"Call features for bonds or preferred stocks may affect the yield. For zero coupon, compound interest and multiplier securities, there are no periodic payments and securities may be callable below maturity value without notice to holder unless registered. For asset-backed securities, the actual yield may vary depending on the speed at which the underlying note is pre-paid. For additional information regarding bond yield, please contact the IB Help Desk at: help@interactivebrokers.com. If this debt security is unrated by a nationally recognized statistical rating organization, it may pose a high risk of default. You should consult a financial advisor to determine whether unrated bonds are appropriate for your portfolio in light of your goals and your financial circumstances."
Notes/Legal Notes,Data,Legal Notes,"Please promptly report any inaccuracy or discrepancy in this statement, or in your account. Contact the IB Customer Service Department in writing using the form available on the IB website. You may also contact IB by phone, but if you report an error by phone, you should re-confirm such oral communication in writing in order to protect your rights, including rights under the Securities Investor Protection Act (SIPA).Interactive Brokers LLC, www.interactivebrokers.com, 877-442-2757 (U.S.)Interactive Brokers (UK) (Ltd), www.interactivebrokers.co.uk, 00800-42-276537 (Intl)Interactive Brokers Canada Inc., www.interactivebrokers.ca, 877-745-4222 (Can.)"
Notes/Legal Notes,Data,Legal Notes,"Unless otherwise noted, Interactive Brokers acted as agent in the execution of the above transactions. For those exchanges where IB is not a direct clearing member or custodian, IB may use one of the following clearing agents or sub-custodians: Interactive Brokers Australia Pty Limited; Interactive Brokers Canada Inc.; Interactive Brokers Hong Kong Limited; Interactive Brokers Securities Japan, Inc.; Interactive Brokers (U.K.) Limited; Timber Hill Europe AG; ABN Amro Clearing Singapore Pte. Ltd.; ABN Amro Clearing Sydney Pty Ltd.; BBVA Bancomer, S.A.; BNP Securities Services, Milan Branch; BMO Harris Bank N.A.; Citibank International plc; Euroclear Bank S.A./N.V.; Shinhan Securities Co., Ltd.; Skandinaviska Enskilda Banken AB. As you previously consented in writing in your Covestor (IB Asset Management) Investment Management Agreement, Interactive Brokers LLC may execute your orders against other Interactive Brokers LLC customers. You may revoke your prior written consent to these transactions at any time by providing written notice to either IB Asset Management or Interactive Brokers LLC."
Notes/Legal Notes,Data,Legal Notes,"IB acts as agent or riskless principal in foreign currency exchange transactions.  Such transactions are executed against an IB affiliate or a third party, which acts as principal in such transactions and may have a long or short position and may have profited or lost in connection with the transaction.  Foreign currency exchange transactions executed by Customer through IB are not regulated or overseen by the SEC or the CFTC."
Notes/Legal Notes,Data,Legal Notes,"Trades marked with the exchange indicator of TMBR were effected by IB as agent through a market making affiliate, which acted as principal in the transaction and may have a long or short position in the security and may have profited or lost in connection with the transaction."
Notes/Legal Notes,Data,Legal Notes,"All VWAP trades are effected pursuant to an average price formula based on a reference price provided by a third-party data provider. Additional information and reference prices are available upon request. IB, as agent, effects VWAP transactions through a market making affiliate, which acts as principal in such transactions and may have a long or short position in the security and may have profited or lost in connection with the transaction."
Notes/Legal Notes,Data,Legal Notes,"IB accepts liquidity rebates or other order flow payments from Alternative Trading Systems, market makers and exchanges for certain orders in stocks. IB receives payment for some option orders pursuant to exchange-mandated marketing fee programs or other arrangements. To the extent permissible under exchange rules, IB may direct customer option orders for execution against its market making affiliate Timber Hill LLC, which acts as principal and may earn a profit or incur a loss. The source and nature of any compensation received by IB in connection with any transaction is available upon written request of the customer. For further information, check the IB website and the Order Routing and Payment for Order Flow Disclosure provided when you opened your account and annually or email help@interactivebrokers.com."
Notes/Legal Notes,Data,Legal Notes,"For security futures trades, if not already indicated on this statement, information about the time of any transaction, the identity of the counterparty to the transaction, and whether IB is acting as agent or principal, as agent for the counterparty, as agent for both parties to the contract, or as principal, and if acting as principal, whether the transaction was a block transaction or an exchange for physicals transaction, will be available upon written request of the customer."
Notes/Legal Notes,Data,Legal Notes,Customer is requested to promptly advise Interactive Brokers of any material change in Customer's investment objectives or financial situation.
Notes/Legal Notes,Data,Legal Notes,"A financial statement of Interactive Brokers LLC is available for your personal inspection at www.interactivebrokers.com or at its offices, or a copy of it will be mailed upon your written request."
Notes/Legal Notes,Data,Legal Notes,"For trades executed on either the Australian Stock Exchange Ltd (""ASX"") or Chi-X Australia Pty Ltd (""Chi-X""), this confirmation is issued subject to: (i) the directions, decisions and requirements of the Market Operator, the relevant Market Integrity Rules, the relevant Market Operating Rules, the Clearing Rules and where relevant, the Settlement Rules; (ii) the customs and usages of the relevant Market; and (iii) the correction of errors and omissions. Interactive Brokers LLC (ARBN: 091191141, AFSL: 245574, Participant on Chi-X Australia)(""IB"") is not a participant on the ASX, and will route orders to the ASX through its affiliate, Timber Hill Australia Pty Ltd (ABN 25079993534, AFSL: 244380, Participant on the ASX)(""THA"") who executes such orders. Your ASX and Chi-x Australia trades will be cleared through ABN Amro Clearing Sydney Pty Ltd, an ACH participant. If your transaction was a crossing transaction, IB may have either acted on behalf of (i) both the buyer and seller of this transaction, or (ii) on behalf of the buyer or seller on one side of the transaction and act as Principal on the other side. Under the Corporations Act 2001, where IB enters into an exchange traded derivatives on a customer's behalf, IB is regarded as having issued the derivative to the customer."
Notes/Legal Notes,Data,Legal Notes,"For All Options Trades Executed on the Stock Exchange of Hong Kong (""SEHK""): (a) Options can involve a high degree of risk and may not be suitable for every investor. Investors should ensure they understand those risks before participating in the options market. (b) All options contracts executed on the SEHK were executed by Timber Hill Securities Hong Kong on behalf of Interactive Brokers LLC. (c) In the event of a default committed by Interactive Brokers LLC resulting in the client suffering any pecuniary loss, the client shall have a right to claim under the Investor Compensation Fund established under the Hong Kong Securities and Futures Ordinance, subject to the terms of the Investor Compensation Fund from time to time. (d) All Exchange Traded Options Business made for or on behalf of a client shall be subject to the relevant provisions of the constitution, Rules of The Stock Exchange of Hong Kong Limited (""SEHK Rules""), regulations, the Articles, customs and usages of SEHK, the Options Trading Rules, the Clearing Rules of SEOCH, the CCASS Rules and the laws of Hong Kong, which shall be binding on both Interactive Brokers LLC and the client."
Notes/Legal Notes,Data,Legal Notes,"Deposits held away from Interactive Brokers LLC may not qualify under SIPC protection.  Also, futures and options on futures are not covered by SIPC."
Notes/Legal Notes,Data,,SIPC Member
